爱情经典语录温暖人心的话 让人感动的一句暖心小情话#1.我不需要你有多么完美，我只需要你能让我感觉到我就是你的，你就是我的。 ​​​​ 2.相爱和相处是两回事。相爱是吸引，而相处是为对方而改变。 ​​​​ 3.两个人相爱着，最美好的莫过于一起努力，一起改变，一起梦想。 ​​​​ 4.说真的，我生气归生气，吃醋归吃醋，但是从来没想过离开你。 ​​​​ 5.喜欢就去追，分手了就挽回，吵架了就和解，爱情不需要面子。 ​​​​ 6.选择自己所爱的，爱自己所选择的。 7.你若属于我，那就只属于我一个人，我可不喜欢和别人分享。 ​​​​ 8.两个人在一起，不是为了谁能征服谁，而是两个人互相的依赖与支持。 ​​ 9.可以掌控你心情的那个人，一定是你最爱的人。 ​​​​​​ 10.爱上一个人就是一件没有安全感的事情。越爱一个人，就越会担心他离开，会患得患失，会想更多。 ​​​​ 11.感情其实最怕的不是吵不是闹，而是有话不说的冷漠，冷战只会让人心越战越冷，沟通不成，联系不上，陪伴不了，进退两难，然后才慢慢让两颗心衍生出坚持不下去的念头。 12.我想谈一场公开的恋情，爸妈同意、亲戚知道、朋友祝福的恋爱，如果可以，只谈一场，要么不开始，要么一辈子。 ​​​​​ ​​​​ 13.不要对爱你的人太过刻薄，每个人都有脾气，为你忍下所有的怒气，仅仅因为那个人比你更心疼你。 ​ ​​​​ 14.也许我没有最可爱的眼睛，最甜美的笑容，最美丽的脸庞，或者最完美的身材，但，我有一颗最爱你的心。 ​​​ ​​​​ 15.如果非要我在你和这个世界中做一个选择，我会选你，因为有你让我比拥有全世界还满足。 ​​​​ 16.时光静好，与君语;细水流年，与君同;繁华落尽，与君老。 ​​​​ 17.从陌生到熟悉，慢慢累积我们的感情，有种快乐除了你，任何人都没法给予。 ​​​ 18.想你的人自然会来找你，爱你的人会想尽一切办法来到你的身边。 ​​​​​ 19.喜欢你在我身边没有期限 属于我们的每一天都值得被纪念 ​​​​ 20.我不需要承诺，不需要奉承，不需要谎言，不需要伤害，我所需要的，也只是爱与陪伴。 21.感情里哪来那么多对错，爱的多的那一方永远都会先低头，心都给你了，还要怎么计较。 ​ 22.有本事你就照顾好自己，不然就老老实实地让我来照顾你! ​​​ 23.所有的合适都是两个人的相互迁就和改变，没有天生合适的两个人。两个人朝着相同的方向努力，就是最好的爱情。 ​​​​​ 24.爱就是，我以为我要变得足够好才能遇见你，却发现，原来是遇见了你，我才变成一个最好的我。 ​​​​ 25.如果一个人爱你，不管你的胖瘦、贫富、病或健康，都会一直和你在一起，这是责任感，是对爱情的承担。 26.所谓爱，其实就是陪伴，陪伴，是最好的爱意的表达。肯花时间陪你的人，必是最爱你的人。 ​​​​ 27.喜欢你，就是心里放弃了一千次，也会在你说一句好听的话时，再奋不顾身一万次。 ​​​​#609b43d3a55b16914956534d680bb8b4.jpg
对爱情心灰意冷的句子彻底绝望 一个人无聊寂寞的说说#1.孤独是，早上急忙出门东西被自己弄掉到地上。晚上到家，它们还静静地躺在地板上。 2.距离大概就是指，你知道我没睡，我也知道你没睡，看着彼此更新的消息，却不能说上一句话。 3.手机起码还会提醒我电量不足，可有些人却总是一声不吭的离开。 4.我还是喜欢我自己一个人，没辜负，没牵挂，没感动，也没失望。最深的孤独不是长久的一个人，而是心里没有了任何期望。 5.个人熬过了所有的苦难，也就不期待一定要和谁在一起了;我曾诚心努力过，但结局我不想说。 6.后来再遇到心动的人，我都会想，算了，当朋友就很好了，真的很好了。 7.你是不是又在苦心翻找一句话，只为了给那个人看。 8.痛过之后就不会觉得痛了，有的只会是一颗冷漠的心。 9.别人喜欢你我可以把你抢回来，你喜欢别人要我怎么办? 10.总有那么一个人，一句话就可以把你伤的很彻底。 11.我以为爱可以填满人生的遗憾，而制造更多遗憾的，偏偏是爱。 12.有些痛，有些疲惫，只有自己懂。喜欢在孤独的夜里翻起过去，那些被自己深埋心底的往事，得到的，拥有的，失去的，有种恍然如梦的感觉。 13.你看你，每一天都想放弃，但每一天又都坚持下来了。 14.我的不开心，我的难受，我都尽量留给了自己，我也从不指望任何人心疼我，为我扛下所有。 15.可能我只是个过客，但你不会遇见第二个我。 16.念旧的人总是容易受伤，喜欢用余生等一句别来无恙。只是你念你的旧，他又能记你多久 17.很多事，不是我想，就能做到的。很多东西，不是我要，就能得到的。很多人，不是我留，就能留住的。 18.我有个恋爱，想和你谈一下。 19.我不想去讨好你了，换句话说，我不想再浪费时间去感动自己了。 20.故事不长，也不难讲，只不过是：相识一场，爱而不得。 21.有多少人跟着梁静茹，从勇气唱到了分手快乐。 22.总之，什么事情都能自己为自己买单，就是一种安全感。 23.我最信任的人，用背叛，教会了我不要轻易相信任何人。世界上最远的距离，不是爱，不是恨，而是熟悉的人，渐渐变得陌生。 24.很想主动联系你，很想关心你，很想知道你最近过得好不好，也很想紧紧的抱着你并告诉你，我很爱你很想你，但是有些爱，只能止于唇齿，掩于岁月。 25.我看别人都像情敌，那是因为我喜欢你。 26.我就像个路人一样旁观着你生活，而你的喜怒哀乐也从来都不是为我。 27.在这个世界上，没有一个人能陪你感同身受。你万箭穿心，你痛不欲生，也仅仅是自己的事。#1059b5fba57b0f1a1fa26b1a974bb220.jpg
比阳光还温暖的唯美句子合集 简单干净的唯美说说一句话#1.愿你坚强，身处不如意时从容不慌张。 2.愿你精致到老，眼里长着太阳，笑里全是坦荡。 3.希望阳光很暖，微风不燥，时光不老，你我都好。 4.愿世界化为沧海，愿你我归于初见。 5.能错过是福气，能遇见也是。 6.有些事情你越是拼命去抓住它，你受到的伤害就越多，倒不如及时放开双手，随它去。 7.可能骨子里，就是个淡漠的人，没有特别挚爱的东西，没有一定要得到的人也没有非做不可的事。 8.我还是很喜欢你 像风走了八千里 不问归期。 9.你一定是偷偷作弊了，不然在我心里怎么可能会是满分。 ​​​​ 10.别人再好，与我无关，你再不好，我都喜欢。 11.喜欢是新鲜感，而爱是归属感。 12.相遇在天，相守在人，珍惜在心 ​​​​ 13.喜欢是急着确定关系，爱是等自己有能力给她一个家 14.愿余生有人鲜衣怒马，陪你看烈焰繁花，愿余生有人素面白纱，陪你度恬淡年华。 15.时光温柔，还需你懂，生活可爱，也需你宠。 16.一房两人，三餐四季，一生一世一双人。 17.我会用最初的心，陪你走最远的路 18.既许一人以偏爱，愿尽余生之慷慨。 19.有酒就去喝，有爱就去爱，人一生那么短，再拘谨几下就真的过去了 20.心动不是恋爱，心定才是。 21.向来心是看客心，奈何人是剧中人 22.不为往事扰，余生只愿笑。 23.自己爱自己，比谁爱你都靠谱。 24.人生四然：来是偶然，去是必然，尽其当然，顺其自然。 ​ ​​​​ 25.我陪你走的路你不能忘，因为那是我最快乐的时光。 26.一生可以喜欢很多人，但最爱的只有一个。 27.你是我执着的理由，也是我疯狂的借口 28.心无旁骛似明镜，无风何处起涟漪。#96b714ee9c439ed17d1589cc7fc74c78.jpg
恋爱中的幸福美好小情话合集 恋爱中男女之间说的一些情话#1.多看一眼就心软，拥抱一下就沦陷。 ​​​​ 2.一心一意写一个喜欢的故事，一生一世爱一个值得的人。 ​​​​ 3.真正的爱情是，我让你动了心，你让我安了心。 ​​​​ 4.我能跟你闹，跟你聊，逗你笑，说明你很重要。 ​​​​ 5.女孩子不讲理的时候，你让几分，她就多爱你几分。 6.想你的人自然会来找你，爱你的人会想尽一切办法来到你的身边。 ​​​​ 7.说爱你的人不一定等得起你，但等你的人一定很爱你。 ​​​​ 8.我把我整个灵魂都给你，连同它的怪癖，耍小脾气，忽明忽暗，一千八百种坏毛病。它真讨厌，只有一点好，爱你。 9.我不懂什么是爱，我只知道，我老是会想到你，你回我消息我就开心，你不理我我就难过。 10.世界上没有第二个你，也没有第二个我。我们在一起，就是唯一。 ​​​​ 11.多愁善感是因为害怕失去你，毕竟是花光所有运气才遇到你。 ​​​​ 12.想把世界上最好的都给你，却发现世界上最好的就是你。 ​​​​ 13.最美好的两件事是：睡觉和你，简称睡你。 ​​​​ 14.专一不是一辈子只喜欢一个人，是喜欢一个人的时候一心一意。 ​​​​ 15.不必承诺永远，只要爱我一天又一天。 ​​​​ 16.想了一晚上的悄悄话，开口却只成了早安。攒了一天的新鲜事，开口却又成了晚安。 ​​​​ 17.你以为我是个话痨，其实我只是太喜欢你。 ​​​​ 18.我不需要你有多么完美，我只需要你能让我感觉到我就是你的，你就是我的。 19.我已经习惯了听到你的名字就反射性的抬起头。 ​​​​ 20.细节往往胜过情话，陪伴往往胜过言语。 ​​​​ 21.两个人在一起最重要的除了信任就是包容，两个人慢慢磨合才会更合适。 ​​​ ​​​​ 22.爱你的人不会因为你的冷落而离开，要走的人不会因为你的挽留而停步。 ​​​​ 23.爱情有时候很简单，无非就是你崇拜我，我宠爱你。 ​​​​ 24.我不是最好的但肯定是你再也遇不到的。 ​​​​ 25.世界再大，我也能一眼就看到你;我的心再大，心里也只装你一人。 ​​​​ 26.除了我，每个人都不适合和你白头到老。 ​​​​ 27.多想有一天，我们不再互道晚安，而是睡在彼此的身边。 ​​​​ ​​​​#d7d7648a2eab2ceed9d74e2fa19db505.jpg
结婚表白最感人的话2019最新版 甜甜的让对方沉醉的情话#1.什么是一心一意，没选择是你，有选择还是你，选择了你，便不再选择，永远是你。 ​​​​ 2.有时很喜欢一个人的感觉大概就是：什么都介意却又什么都原谅。 ​​​​ 3.我只希望我们好好的，好好的笑，好好的爱，好好的过，好好的一辈子~ ​​​​ 4.我想每天都见到你 更想一翻身就你抱住你 ​​​​ 5.不想你惊艳我年少时光只愿你暖我今后岁月。 6.喜欢你大概就是，看到你对别人也很好时，就会不太想理你。 ​​​​ 7.最怕我们的爱最终会输给时间，败给距离。 ​​​​ 8.以后你的手我来牵，你的泪我来擦，你的所有任性小脾气我来包容。 ​​​​ 9.我若在你心上，情敌三千又何妨。你若在我身旁，负了天下又怎样。 ​​​​ 10.你不珍惜，我就会走，即使我很喜欢你。 ​​​​ 11.你对别人有一点点好我都有想瞬间掐死你的冲动。 ​ 12.我不喜欢别人喜欢你，更不喜欢喜欢别人的你，因为我喜欢你。 ​​​​ 13.我只有两个心愿：你在身边，在你身边。 ​​​​ 14.如果最后能在一起，晚点也真的无所谓。 ​​​​ 15.好的感情不是被碰巧撞到的，它需要时间经营，耐心包容，还有两个人真心想要在一起的人。 ​​​​ 16.我心太窄了，心眼太小了，见不得你跟别人好。 ​​​​ 17.因为有你我才能笑着摇头拒绝所有诱惑和暧昧。 ​​​​ 18.我那么酷的一个人放下架子来哄你你说我是有多爱你。 ​​​​ 19.人生最宝贵的不是你拥有的物质，而是陪伴在你身边的人。 ​​​​ 20.我们打闹我们吵架我们互相折磨，但我知道，我们不能分开，我们不会分开。 ​​​​ 21.全世界就一个我，你珍惜也好，不珍惜也罢。如果哪天你把我弄丢了就再也找不回来了。 ​​​​ 22.要用最好的自己去对待最爱的人，而不是用最坏的自己去考验对方是否爱你。 ​​​​ 23.我希望遇到一个人，长的像你，性格像你，最好是你。 ​​​​ 24.没必要和女友争个面红耳赤，她错了，你让着，她会感激你，其实她知道是她不讲理。 25.我们以后在一起，你负责宠我，我负责可爱。​​​​ 26.世界上最爱你的人，就是那个舍得花时间陪你的人。 ​​​​ 27.我从来都不是突然好想你，我是一直好想你，好想好想你。 ​​​​#f650457eb9f77de0e0280a7bfeee97de.jpg
让人一下子就心动的撩人情话合集 女生无法抗拒的撩人情话#1.谢谢你撑到我找到你 2.我之前没有爱过别人 你是第一个 我怕我做得不好 让你觉得爱情不过如此 3.我以一名共和国战士的名誉担保，我会像守护祖国一样的守护你，爱着你。 4.住在心里的女孩 以后也要住进家里 5.我也不是无聊，我宿舍有电脑，我还要去洗衣服，那么多事我都放那，就因为你睡得早，我想跟你多聊会。 6.人间不值得 但是你值得 7.我觉得现在遇见你最好，不早也不晚。太早了，怕走不到最后，太晚了，怕你被坏人伤害，就是让你之前等急了。我们都在乖乖等着对方出现，所以缘分对我们还是很好的。 8.“我先去洗澡了，等下聊”过了一会，“我洗好了，在干嘛”每天重复如此，真的是天使啊，胜过所有情话 9.我寻了半生的春天，你一笑，便是了 10.天气这么冷 我们要不以后一起过吧 11.希望你是一块坏了的表，不要再走了。 12.你看了一 场电影，我看了一场你 13.我的勇气加上你的勇气，对付这个世界总够了吧 14.七月的风 八月的雨，卑微的我喜欢遥远的你，你还未来怎敢老去，未来的我和你奉陪到底。 15.别乱动，让我抱抱 16.你真空了我的个人历史，重构了我的时间轴 17.你知道你和星星有什么区别吗?星星在天上，你在我心里。 18.大雨里百鬼夜行 我们混在其中 比鬼还高兴 19.能跟你结婚的话 少活几年也值了 20.除了姑娘的美色 在下不接受任何贿赂 21.剪影的你轮廓太好看，忍住眼泪才敢细看 22.我真的很讨厌异地恋，可是我太喜欢你了 23.我还是很喜欢你，就像小的时候吃辣条，不看日期。 24.你笑时，雷声温柔，暴雨无声。 25.我不看月亮，也不说想你，这样月亮和你都蒙在鼓里 26.我不喜欢这世界我只喜欢你 27.我有房有车 房产证写你名 跟谁姓都行 生不生随你 生男生女都一样不能生也无所谓 我妈会游泳 不和爹妈一起住#b0ca516b71fc21811147fb47030ba781.jpg
好听的霸气的英文句子带翻译2019 经典有气质内涵的英文句子#1.Don't look back, just haven't found leave your reasons.不回头，只是还没找到留下的理由。 2.Not crave forever,because too far.不奢求永远 因为太远。 3.All endings are beginnings, we just don't know it at the time.所有的结局都是新的开始，只是当时不知道。 4.Is there a way never, never, ever change.有没有那样一种永远，永远永远不改变。 5.Look into my eyes - you will see what you mean to me.看看我的眼睛，你会发现你对我而言意味着什么。 6.I only smile with joy，but hide my sorrow deeply.我只有笑的很欢，忧伤才不会被看穿。 7.There is a pain, called the understand.有种痛，叫做懂。 8.There is no hiding from lover's eyes.什么也瞒不过恋人的眼睛。 9.Too many stories have no results. 拥有太多故事却都没有后来。 10.From now on,I will expect nothing,and just take what I get.从现在起，我将不再期待，只珍惜我所拥有。 11.Some habits, however, was to change.有些习惯，无论如何都改不了。 12.What kind of sunlight can warm my heart.什么样的阳光能温暖我的心。 13.Life is tough, my darling, but so are you.生活很艰难，但是宝贝，你也很坚强。 14.The longer the explanation, the bigger the lie.解释的越长，谎言就越大。 15.Is is no use crying over spilt milk.覆水难收 16.The past is never where you think you left it.你以为已抛弃了过去，其实你从来没有。 17.Be strong enough to let go, and patient enough to wait for what you deserve.足够坚强去放手，足够耐心去等待值得的。 18.Some people will have to learn how to appreciate you by losing you.总有些人在失去你以后才会懂得你的好。 19.A great love will outlast time, endure hardship, overcome distance, and withstand longing.好的爱情，战得胜时间，抵得住流年，经得起离别，受得住想念。 20.You can't expect him to be perfectnobody is.别期待他是完美的，没人是完美的。 21.However, you are the one I love.What can I complain about 毕竟是我爱的人，我能够怪你什么。 22.I'm afraid I can not catch you, just leave me alone.我怕我抓不住你，留下我个人孤独。 23.Tears are the words which the heart can not say. 眼泪是心无法诉说的话语。 24.Sometimes you have to give up on someone in order to respect yourself.有时候我们必须放弃一些人，来成全自己的自尊。 25.No matter how strong you are,someone will always be your fatal.无论你有多坚强，总有人是你的致命伤。 26.However long the night， the dawn will break.不管黑夜有多长，天亮总会到来。 27.worth it to be with someone who knows your worth.和一个懂你的人在一起，什么都是值得的! 28.An artificial another lifetime silly once is enough.一个人为另一个人一辈子傻一次就够了。#10d01e1d69ea1b5ac99f5b51430eb5f2.jpg
天气很冷的微信朋友圈说说最新 冬天下雪了唯美句子说说精选#1.天冷了如果给不了我拥抱，请给我一个外套，XL号，谢谢。 2.天好冷，我的心也跟着冰冷起来，也许这就是适合我的季节。 3.冬天的时候最讨厌的就是，脱个精光，刚刚跳进温暖的被窝裹的严严实实才发现，尼玛灯居然没关。 4.天冷了，最想去的地方除了被窝，还有你的怀里。 5.冷就一个字，我只说一次，我知道你会用鼻涕代替。 6.我喜欢早上起床看到信息或者未接来电我喜欢天冷了有人叫我穿多件衣服。 7.霜降了，天气冷了，愿我的每个字都能融化你冰冷的心房;愿我的每句话都能带给你温馨，愿我的每条短信都能让你开心。祝你霜降快乐，生活幸福! 8.十二月，天空中下起来鹅毛大雪，到处是一片白色，唯有松树还是那样鲜绿，点点雪片飘落在上面，好像是朵朵白花。 9.天气冷了希望我爱的人和爱我的人不会生病好好的度过这个严冬。 10.天气冷了，雪花飘了，元旦就要到了，我要用温馨做皮，将甜蜜做馅，把每个褶纹都捏出关怀，最后用热情的水煮熟，为你送上精心制作出的新年饺子。 11.天气寒冷时节，不仅要重视增衣保暖，还应该加强体育锻炼。要想增强机体的耐受能力，最根本的就是加强运动。人体新陈代谢越旺盛，耐寒能力就越强。 12.天越来越冷了，大家有女朋友的抱女朋友，有男朋友的抱男朋友，我去添件衣裳。 13.房顶破了好几个洞，连绵不绝的雨水如根根麻线密集而又无情地落到屋里，打湿了整间贫寒的小屋，空气里满是寒冷，我的眉毛上几乎都可以结上层霜。 14.十二月，一层薄薄的白雪，像巨大的轻软的羊毛毯子，覆盖摘在这广漠的荒原上，闪着寒冷的银光。 15.随着天气的逐渐寒冷，人的手也变得没有那么灵活，身体开始出现疲乏感，总感觉力不从心，于是乎…… 16.小雪花在空中旋转着， 跳着优美的空中芭蕾，飘飘洒洒地铺在大地上。 17.寒冷的雨夹雪天气，在充满暖气的店里，吃着衡水特色—沧州火锅鸡，当全身冒汗的时候，再来一瓶老白干，沁人心脾。 18.傍晚，天空中布满了铅色的阴云，黑沉沉阴森森的。忽然，我发现下雪了。你瞧，那空中飘舞的小 精灵，身轻似烟，洁白如玉，盘旋地，欢快地降临到这个世界中。片刻，雪大了，纷纷扬扬，飘飘洒洒。 19.会在未来的某个时刻唤醒，我想在唤醒的那一刻我也会很欣然的。毕竟，我曾经在这样一个冬日，慢慢地行走，慢慢地欣赏。 20.天冷了，多穿衣是为了不哆嗦，哆哆嗦嗦就像帕金森;天冷了，少穿衣是为了不臃肿，臃臃肿肿就像大狗熊;天冷了，不穿衣，会怎么样呢?肯定会感冒呗。 21.小寒湖面冰封严，大雪纷飞不稀罕，多做运动要保暖，改变冬闲旧习惯。不怕风霜不怕寒，适应环境最关键!天气冷了，注意身体。 22.天气冷了要加衣服每时每刻都要想我。 23.漫天飞舞的雪花像一只只美丽的白蝴蝶，纯洁无暇，晶莹剔透，纷纷扬扬，飘飘洒洒地从一望无际 的天空中飘落下来，它时而像一位隐士，时而像一只活泼的小精灵，时而又像一位优雅的公主，和我一 起嬉戏玩耍。 24.不在你身边的时候照顾好自己，天气冷了记得多穿点衣服，别让自己感冒了，知道么? 25.天气变得很快 气温变得真坏 出门外套要带睡觉被子要盖 多吃水果青菜 好好保持心态这是对你关爱。 26.寒潮来临，注意保暖，身体重要，经常锻炼，吃好睡好，心宽体健，控制欲望，心态坦然，多多保重，天高地宽。#f294cbfe5b3d604e768052969a173350.jpg
经典文字控爱情说说女生专属 写给喜欢的人的暖心爱情句子#1.比起永远，我更喜欢每天。 2.我就是看不惯你喜欢别人的样子。 3.注定在一起的人，不管绕多大一圈依然会回到彼此的身边。 ​​​​ 4.如果岁月不解风情，使你变得又坏又丑又糟时，我也会无所谓地，笑一笑，继续抱着你。 ​​​​ 5.努力成为你离不开的人那也是我的梦想。 ​​​​ 6.做事总是三分钟热度的我，却爱了你这么久。平常丢三落四的我，却把你记得那么清。 ​​​​ 7.你敢和我在一起，我有什么资格辜负你。 ​​​​ 8.如果有个人，你删了他又加他又删他再加他，那你一定，有时挺爱他有时又恨他，删来删去却删不掉牵挂。 ​​​​ 9.感觉只要每天能跟你发几条消息，说几句话，我整个人都会幸福得一塌糊涂。 ​​​​ 10.一些该拿起的要拿起，一些该舍弃的要舍弃。因为，只有让该结束的结束了，该开始的才会开始。 ​​​ ​​​​ 11.幸福，大概就是，你喜欢粘着的那个人，永远都不嫌你烦。 ​​​​感情里哪来那么多对错，爱的多的那一方永远都会先低头。 ​​​​ 12.看一个人爱你的程度，不是浪漫的时候，他对你有多好，而是，开始吵架的时候，他能让你多少。 ​​​​ 13.我只想要一场婚礼，一件婚纱，一对戒指，一个伴儿，一直到老。 ​​​​ 14.全世界就一个我，你珍惜也好，不珍惜也罢。如果哪天你把我弄丢了就再也找不回来了。 ​​​​ 15.我没无理取闹只是动了感情才喜怒无常。 ​​​​ 16.我不喜欢别人喜欢你，更不喜欢喜欢别人的你，因为我喜欢你。 ​​​​ 17.真正爱你的人会督促你变得更优秀，而不是磋砣你的青春。 ​​​​ 18.在这世上，没有非爱不可的人，也没有非做不可的事。除非，那个人是你，那件事是我爱你。 ​​​​ 19.每一个笑点低的女孩，泪点也很低。 ​​​​ 20.不是因为习惯才想你，而是因为想你已成习惯。 ​​​​ 21.如果某人走进你的生活，使你成为一个更好的人，并能够忘掉你的过去，那么你永远不要让他离开。 ​​​​ 22.还没离开，就开始想念，原来没有你真的很不习惯。 ​​​​ 23.不希望你被太多人喜欢，我喜欢就好。 ​​​​ 24.我们之间的关系就好像一场游戏，我练到满级，你删了游戏。 ​​​ ​​​​ 25.爱情到最后，不是比谁更出色，而是看谁最后能留在你身边。 ​​​​ 26.遇见你，我遇到生命里的阳光，而今生有你，便我是最美的风景。 ​​​​ 27.我可以专一到让你惊讶，也可以花心到让你害怕。 ​​​​#fccb970bbd9de6a05b83e5ff51641df8.jpg
