霸气经典哲理说说大全 未来路还长你要挺直胸膛#1.失败的人只有一种，就是在抵达成功之前放弃的人。 2.你的眼睛会发光不适合悲伤，未来路还长你要挺直胸膛。 3.今朝灯火阑珊处，何忧无友；它年折桂古蟾宫，必定有君 4.不主动会失去，太主动不会珍惜，这就是人心。 5.不要觉得自己很不幸，世界上比我们更苦的人还很多。 6.愤怒是吹熄心灵明灯的狂风。 7.不要期待人人都喜欢你，别在意他们怎么看你。 8.对我好的和坏的人，都是我的贵人。 9.就算疲惫不堪还要继续拥抱明天。 10.希望你能越来越喜欢我 然后表现得明显一点 11.必须要暗自努力 才能在人前 显得轻松如意. 12.最怕那种突然而又不负责任的喜欢 13.世界终会为你的勇敢而让步。 14.别跟我讲励志的故事，那是说给失败者听的。 15.人最富有的，并不是拥有一座金山，而是拥有一座金山买不到的东西。 16.爱情就像鬼，相信的人多，看见的人少。 17.不要把秘密告诉你的好朋友因为好朋友也有好朋友。 18.趁着年轻你需要多受一些苦，然后才会真正谦恭，不然你那自以为是的聪明和藐视一切的优越感迟早要毁了你。 19.把爱情投资在一个人身上，冒险;把爱情投资在许多人身上，危险。 20.乐观的人只顾著笑，而忘了怨;悲观的人只顾著怨，而忘了笑。 21.人生无完美，曲折也风景，只有随遇而安，才能随心所欲。 22.放得下就不孤独，站得远些就清楚，不幻想就没感触，不期待就不在乎。 23.已经路过的风景就不要再打听了，当你选定一条路，另一条路的风景便与你无关。 24.人，最好的心态是平静;最好的状态是简单;最好的感觉是自由;最好的心情是童心。 25.学会忘记痛苦，为阳光记忆腾出空间。 26.爱情就像两个拉着橡皮筋的人，受伤的总是不愿意放手的那个。 27.成功的人找方法，失败的人找借口;要成功就没有借口，要借口就不可能会成功。 28.特别警惕种人:一,官不大,特能办事的人;挣钱不多,特能花钱的人;不太熟,特能套瓷的人。#f79e8134141bc661779b3495a56cde17.jpg
2019抖音最火情侣说说 很甜很撩人的说说艾特对象#1.大概被世界温柔的爱着的人，才会这般温暖吧! 2.人活着实诚点直接点我很饿我想喝酒我喜欢你 3.初次见你的时候没有想过日后会如此喜欢你。 4.我们在一起，我负责可爱，你负责宠我。 5.承蒙你的出现，够我喜欢一辈子 6.就是把你艾特出来，告诉她们，我有最好的你 7.我说不出来为什么爱你，但我知道，你就是我不爱别人的理由。 8.喜欢被宠，如果哪天我过得好好的突然不小心被人宠死的话，我也一点意见都没有。 9.我解过那么多数学题，可是我却解不开你的。 10.有一句话，宾语是你。吉下两点一口，又有欠字相依。 11.我会爱你很久很久，和你度过每个情人节 12.喜欢你 认真且怂，从一而终 13.如果你愿意，我就喜欢你，如果你不愿意，我就单相思，你愿意吗? 14.不是除了你，我就没人要了。只是除了你，我谁都不想要。 15.请你从我梦里出去，或者，再也不要离开。 16.除了你没有下一个 17.齐天大圣是你，盖世英雄是你，意中人也是你。 18.超级喜欢你，嘴上三分心里十分。 19.我的床不大不小，用来抱着你睡正好。 20.欲望本该像野马可我只想要你 21.因为喜欢，所以会介意很多事，要是不喜欢，就不会生那么多气了。 22.我说，在看不到你的时候，就是我最寂寞的时候。 23.我莫名奇妙的笑了，只正因想到了你。 24.我想触动你的心，就像你触动了我的心那样。 25.我也想遇见一个人，为他花开满城，为他明灯三千。 26.我不知道该说什么，只是突然在这一刻很想你。 27.见什么世面见见你就好了 28.我有一句喜欢你不知当讲不当讲 29.想和你喝酒是假的，想醉你怀里是真的。#46f4333623e66bc1b60df49c3d86555b.jpg
一次次被伤害的说说 被爱情伤的体无完肤的句子#1.我的主动在，你眼里是不是特别廉价？ 2.我已经被伤害一次了，不想再被伤害第二次。 3.你永远都不知道我为你哭得喘不过气的样子。 4.不管你经历多痛的事情，到最后都会渐渐遗忘。因为，没有什么能敌得过时光。 5.当眼泪流尽的时候，留下的应该是坚强。 6.我像疯子一样喜欢你，你却想瞎子一样看不见。 7.我怕我最后连吃醋的身份都没有，连忘记的勇气都没有。 8.我做过最勇敢的两件事：大概一件是喜欢你一件是决定忘记你。 9.也许他只是暧昧成瘾，而你却走了心。 10.有人曾经说过，当你停下来思考自己是否爱着某个人的时候，那就表示你已经不再爱他了。 11.我没有饮过最烈的酒，但我放弃过最爱的人。 12.若深情总被辜负，余生尽是孤独又何妨。 13.我们是平行的铁轨，除非发生事故，否则不会错位。 14.总是把自己伤的遍体鳞伤的时候才学会爱自己 15.这世上最难堪的事不是他不爱你，而是他说很爱很爱你，最后却轻易地放弃了你。 16.与我话不投机的人，请自觉的闭上你的嘴！！ 17.成熟不是心变老，而是心碎还能咧嘴笑。 18.当爱人不爱了都要微笑好吗 19.有些事，我假装不知道，知道了，只会让自己更加心痛。 20.我拼了命的让你注意我，最后才发现，是自己太自作多情了。 21.哭了很久很久后才发现，原来眼泪是流不尽的。 22.或许是我把暧昧当做是爱情，所以误了你也误了我。 23.如果有一天你发现我不再计较那么多，那不是体谅，是放弃。 24.忘记，那么冰凉，绝意，却最相思。 25.如果有个人对你特别好，记得千万别把那个人弄丢了。 26.爱情是两个人的天荒地老，不是一个人的一厢情愿。 27.我不后悔爱过你。哪怕你伤的我那么深。 28.主动久了，每个人都会累，不是不爱了，只是心累了。 29.别把我对你的死心塌地，当做是你对我爱搭不理的资本，好吗？ 30.爱情一定是婚姻的前提，而珍惜，才是携手鬓白的那份必须的执念。#68a2d46afaf4d9fdff9b6047acc01cbb.jpg
夏天要这样发微博 微博小清新文艺句子合集2019#1.夏 天 要 这 样 发 微 博 隔 开 散 热 快 一 点  2.若 故 事 从 头  我 爱 你 依 旧 3.我 有 句 话 想 对 你 说，去 掉 有 话 和 对 说 4.承 蒙 你 出 现，够 我 喜 欢 好 多 年  5.祝 你 岁 月 无 波 澜，敬 我 余 生 不 悲 欢 6.每 一 个 人 在 世 界 上 都 要 受 挫 折，有 许 多 人 反 而 在 折 断 的 地 方 长 得 最 结 实。 7.没 有 欢 笑 的 时 光，是 虚 度 的 光 阴。 8.人 不 必 太 美，只 要 有 人 深 爱。人 不 必 太 富，只 要 过 得 温 暖。 9.最好的地方，是没去过的地方。最好的时光，是回不来的时光。 10.你仿佛置身于山水之涧，苍苍水阔，你一声声温柔的轻唤，将忧伤打落，一地的微蓝。 11.弯弯那婉约的心弦，有一种说不出的凄楚之美，抒写的着我们飘在空中的一曲曲化蝶的旋律，琴音清绝，曲韵悠长。 12.岁月的花开，开到茶蘼，一瞬的烟花，犹如繁华过后的一场梦境。 13.问君，可知我半笺幽恨寄断肠，尘封心底的门扉，在爱与痛的边缘辗转徘徊。 14.岁月很长，人海茫茫，别回头也别将就，自然会有良人来爱你。 15.喜欢一个人，是一万次心跳呼吸，也是一万次低头叹息 16.眼角眉梢是他，四面八方是他，上天入地是他，成也是他，败也是他。 17.海底月是天上月，眼前人是心上人 18.如果没有了眼泪，心便是一片干涸的湖。 19.不管天气怎样，给自己的世界一片晴朗；不管季节变换，让自己的内心鸟语花香。 20.余生没那么长，不用一味的付出，去惯得寸进尺的人，请忠于自己，活得像最初的模样。 21.愿你一生努力，一生被爱，想要的都拥有，得不到的都释怀。 22.我把想念寄存在风里，纵使你在万里之遥，却还是会吹在你身旁，看你安好。 23.既然爱，为什么不说出口，有些东西失去了，就再也回不来了! 24.成熟是给陌生人看的，傻逼是给小伙伴看的，幼稚是给喜欢的人看的。 25.年年岁岁花相似，岁岁年年人不同。无论我怎样的修饰，都掩不住眼角额际的皱纹，都找不回那个年轻妩媚的面容。 26.起身，仰望，额间清愁已入眼底。薄洒的酒香，肆意熏醉，蒸晕了两腮，嫣红。 27.指间漫漫轨迹，如此繁复，静书笔端流年，相思腕底，有一种，即使是在梦里也无法躲开的疼痛缭绕着。 28.千年情缘赋做歌，任流年千回，恋红尘几许，心若浮尘，锦瑟无端。#98707735d7197e8ca023dc12576e66d0.jpg
朋友结婚朋友圈说说独特创意 朋友结婚祝福语2019精选#1.永不退色的是相互的关心，是无穷无尽深深的爱!爱情也因这一刻的融合而更温馨更美好!祝你们爆头偕老! 2.祝你们永远相爱，携手共渡美丽人生。 3.他是词，你是谱，你俩就是一首和谐的歌。 4.愿天下有情人终成眷属，前生注定，喜结良缘。 5.洞房花烛交颈鸳鸯双得意，夫妻恩爱和鸣凤鸾两多情! 6.缘分的牵引，让两个人生的轨迹交错，编织出炫耀夺目爱的花纹!衷心的祝福你们：相互珍惜，同心永结! 7.阳光是你的点缀，优雅是你的智慧，温情是你的妩媚，爱心是你的宝贝。今天是你的婚礼，愿快乐与你做陪，美丽将你跟随，青春为你陶醉。 8.听说你们郎有才，女有貌，情有投，意有合，在花又好，月又圆的今天，要缘定三生，特来祝贺：美满良缘，白首成约！ 9.两情相悦的最高境界是相对两无厌，祝福一对新人真心相爱，相约永久恭贺新婚之禧! 10.珍惜这爱情，如珍惜着宝藏，轻轻地走进这情感的圣殿，去感受每一刻美妙时光。 11.十年修得同船渡，百年修得共枕眠。于茫茫人海中找到她，分明是千年前的一段缘，祝你俩幸福美满，共谐连理。 12.真诚的爱情的结合是一切结合中最纯洁的，祝福你们。 13.我祝愿随风送去，你们遇到风时记住倾听，你们的回应要随风飘来，我等待着你们美好的高兴!愿你们相亲相爱，永结同心！ 14.珍惜这爱情，如珍惜着宝藏，轻轻地走进这情感的圣殿，去感受每一刻美妙时光。 15.两情相悦的最高境界是相对两无厌，祝福一对新人真心相爱，相约永久恭贺新婚之禧! 16.今天是你们喜结良缘的日子，我代表我家人祝贺你们，祝你俩幸福美满，永寿偕老! 17.愿你们真诚的相爱之火，如初升的太阳，越久越旺；让众水也不能熄灭，大水也不能淹没！ 18.今夕何夕，空气里都充满了醉人的甜蜜。谨祝我最亲爱的朋友，从今后，爱河永浴! 19.为你祝福，为你欢笑，因为在今天，我的内心也跟你一样的欢腾、快乐!祝你们，百年好合!白头到老! 20.祝你们永结同心，百年好合!新婚愉快，甜甜蜜蜜! 21.恭喜你找到共度一生的灵魂伴侣，婚姻是人生大事，相信你做出的会是最明智的决定。 22.花好月圆，喜事连连，祝愿你们婚姻坚不可摧，爱情牢不可破!和和美美，白头偕老。 23.堕入爱河是一份幸运，步入婚姻是一份美好，这份幸运的美好更是一份职责!祝愿你们永久互敬互爱，甜美美好! 24.一祝你们恩爱甜美，夫妻共白头;二祝你们比翼齐飞，工作更兴盛;三祝你们早生贵子，一代更比一代强! 25.愿你们的家园如同伊甸园般地美好和谐，在地如同在天! 26.愿耶和华从至圣所赐福于你，愿你们一生一世都看见圣城耶路撒冷的好处! 27.愿你们一生听从圣经，孝敬上辈，友爱邻舍;好使你们在世得福百倍，将来大得赏赐!#866f5841bb13905f3630f89116110f1f.jpg
非常有意思搞笑的微信说说 专治不开心的句子#1.小时候不爱吃饭，导致现在个矮；现在是爱吃饭了，导致又胖又矮。 2.驾校教练：红灯不走，绿灯也不走，怎么？没你喜欢的颜色？ 3.感觉自己得了健忘症，一进商场就忘记自己没钱的事实。 4.机会就像秃子头上一根毛，你抓住就抓住了，抓不住就没了。 5.点赞真是一种非常高冷的表现方式，不给对方任何回复的机会，就只是默默的告诉别人，朕已阅。 6.不想洗衣服怎么办。取个媳妇就可以了，如果媳妇贤惠，就给你洗衣服了；如果媳妇彪悍，你就学会洗衣服了。 7.小时候被奶奶叫龟孙子，稍微长大点被叫兔崽子，如今却沦为一只单身狗，我这一辈子简直就是一部禽兽史！ 8.我曾经幼稚的以为钱可以买到友谊，买到爱情，买到任何你需要的东西。长大后，我才意识到钱真的可以买到你需要的东西，但是，我没有钱。 9.你去找一个能逗你笑的人吧，我做不到，我只能把你美哭。 10.时间不是猪饲料，时间也不是杀猪刀。时间之所以变成了饲料，变成了刀，源于你是猪 11.听说休息不规律 对身体危害很大 吓得我天天熬夜 熬得很有规律 12.我们是好朋友，你跌倒的时候，我会扶你一把，不过要先等我笑完 13.热恋时，情侣们常感叹上辈子积了什么德；结婚后，夫妻们常怀疑上辈子造了什么孽。 14.真爱就是，他能越过千千万万个巨胸、长腿、大美女，一眼就能看到粗暴、狂野、没内涵的你。 15.不想洗衣服怎么办。取个媳妇就可以了，如果媳妇贤惠，就给你洗衣服了；如果媳妇彪悍，你就学会洗衣服了。 16.别人的脸是七分天注定，三分靠打扮，你的脸是一分天注定，九分靠滤镜。 17.四海八荒我一女子来到凡间，只为渡今生的一个劫：穷 18.小短腿个子矮不要怕 你除了可爱以外 你捡钱的速度也比别人快 19.一年里我最喜欢的月份就是二月了呢，这个月只需要单身28天呢 20.心情不好的时候 我就半夜给别人打骚扰电话，把他们吵醒了 我就睡觉 21.你要是喜欢一个女生 就好好学习 找个好工作 挣好多好多钱 等她结婚的时候 你多出点份子钱 22.我警告你，我不开心的时候，你别跟我嬉皮笑脸的，因为你一笑，我也想笑，我很尴尬知道么！ 23.你瘦的时候在我心里，后来胖了，卡在里面出不来了。 24.你走了之后我没有难过，还很高兴，要不然总担心你是不是腿脚有啥毛病，走不了路。 25.生活就像淋浴，方向转错，水深火热。 26.一出门就看到太阳公公在问我，请问你今儿要七分熟还是八分熟？ 27.那天我去北海看你了，真的，我也不敢相信我的眼睛，你站在蔚蓝的海边，我还拿小棍捅了你一下，嘿！这个小王八，壳还挺硬！#dd2fdf098021f0c802294ab9a6db096c.jpg
情侣秀恩爱霸气短句子 qq幸福说说情侣专用#1.我说，在看不到你的时候，就是我最寂寞的时候。 2.我想触动你的心，就像你触动了我的心那样。 3.我喜欢你，认真而怂，从一而终。 4.前半生到处流浪 后半生为你煲汤 5.段位和你 我都想上 6.山外青山楼外楼 江山不及你温柔  7.这辈子最疯狂的事，就是爱上了你，最大的希望，就是有你陪我疯一辈子。 8.其实我努力过，只是你未曾在意过 9.晴天 阴天 下雨天 都不及和你聊天   10.寒来暑往 秋收冬藏 我们来日方长 11.第十八层是地狱 第十九层是你   12.只许州官放火 不许你离开我 13.不思进取 思你 14.我提到你 眼睛都在发亮 15.想你大赛我总是排名第一 16.不管到最后我们有没有在一起，你早已成为我生命中最重要的人了。 17.是不是说一句我想你就可以永远不分离。 18.喜欢上一个人好像失火，焚心烧肺、痛的、热的、我渴望的、我惧怕的、都是你。 19.我这才明白，真正爱一个人后，眼角眉梢都是你，四面八方都是你，上天入地都是你，成是你，败也是你。 20.无论碰见多少个美好的人，我都始终愿意一意孤行等待和你相聚的日子。路很长 爱很久 21.所爱隔山海 山海皆可平 22.有了你，我迷失了自我。失去你，我如许生机本人再度迷失。 23.一生经历一次的青春，目的只是听一次花开的声音，看一次花落的寂然，然后散常 24.晴天雨天 皆是老天爷的恩赐 还有你也是 25.倔强的在乎，只是因为想将迩霸道的占为己有 26.我莫名奇妙的笑了，只正因想到了你。 27.请你从我梦里出去，或者，再也不要离开。#d2cefdc786803786b15c04d5f98b8d65.jpg
早安说说唯美文艺句子 qq早安心语简单一句话#1.世界是公平的，忘记一份回忆，你就会懂得一份珍惜。 2.我生命中的温暖就这么多，全部给了你，叫我以后怎么再对别人微笑。 3.不求锁定结局，只求曾经努力;不求事事顺意，只求心情美丽;不求左右别人，只求善待自己;不求马到成功，只求坚定不移。早安! 4.不要害怕做错什么，即使错了，也不必懊恼，人生就是对对错错，何况有许多事，回头看来，对错已经无所谓了。早安。 5.当清晨的第一束阳光洒下，当和煦的第一缕清风吹来，我轻轻把我的第一声祝福送你，祝你幸福平安快乐每一天。 6.我在你心上，情敌三千又何妨。 7.没人愿意就这么看你念着过去不肯向前，满腹牢骚不会笑的样子，那很不可爱。 8.伸手需要一瞬间，牵手却要很多年，无论你遇见谁，他都是你生命该出现的人，绝非偶然”。若无相欠，怎会相见。 9.生活就是那样，不留一丝余地，活下去似乎都需要很大的勇气。早安！ 10.不求与人相比，但求超越自己，要哭就哭出激动的泪水，要笑就笑出成长的性格！ 早安！ 11.绝大多数人，在绝大多数时候，都只能靠自己。 12.吃不了苦就别埋怨生活不给你幸福，做不了事就别抱怨世界给你不公。 早安！ 13.余光满满都是你，亿万星辰尤不及。 14.从此以后此后，你向南我往北，山水不相逢，四海皆无你。 15.没有试过和你一起在双廊洱海边漫步，没有试过和你一起经历夕阳无限好的黄昏，没有试过和你一起背上行囊去旅行，没有试过和你一起戴着同一副耳机听歌，我们甚至都没有试过在一起。 16.我在时光里享受温暖，我在流年里忘记花开。 17.不必哭泣，每个人都是自己世界的主角，没必要成为他人世界的配角。 18.继续可能你会失败，但是放弃，你就连失败的机会都没了。 19.烟花只是一瞬，我却仰头等了一世。 20.这世上没有冷男，只是他暖的不是你。同样这世上也没有女汉子，只是她的温柔没给你。 21.我的爱只能像微风悄悄掠过，任你去做那一只扑火的飞蛾 22.晚风不解离人意，流水却懂故人情。 23.十指太宽，岁月太短，或许山长水远，再无会期。 24.因为有了失败的经历，我们才会更好地把握成功的时机；因为有了痛苦的经历，我们才更懂得珍惜；因为有了失去的经历，我们才不会轻易放弃…… 25.夜阑风细眉心住，透过历史的镜头，你的音容依然交错在我的心目中。 26.不累到极点，怎会懂的休息，不跌倒谷底，怎会寻找出路。 27.包容是一种美德，它体现着一个人的修养和自信。一份理解和包容，就是人与人之间可以互赠的最好礼物。学会包容，也就是选择了通向幸福和快乐方向。#5587542d5c854ed0baf41d1ef6441316.jpg
520朋友圈经典语录 520情人节爱情说说大全2019#1.一个人就算再好，但不愿陪你走下去，那他就是过客。一个人就算有再多缺点，可能处处忍让你，陪你到最后，那就是终点。因为陪伴与懂得，比爱情更加重要。 2.有一些东西错过了，就一辈子错过了。人是会变的，守住一个不变的承诺，却守不住一颗善变的心。 3.人生遇到的每个人，出场顺序真的很重要，很多人如果换一个时间认识，就会有不同的结局。有些爱，只能止于唇齿，掩于岁月 4.怎么会迷上你我在问自己，我什么都能放弃你居然今天难离去，也许你不曾想到我的心会疼，如果这是梦，我愿长醉不愿醒。 5.爱，从来就是一件千回百转的事。不曾被离弃，不曾受伤害，怎懂得爱人？爱，原来是一种经历，但愿人长久。 6.虽然不能满足你最大的物质生活但我可以把我的心来满足你。 7.一片云与一片云之间，是蓝蓝的友情。一簇花蕊与一瓣花朵之间，是粉红的爱情。可我与你的世界，愿你离我最近。 8.如果做不了你的唯一，我连最爱也不要做。如果你给我的，也同样给了别人，那我宁愿不要。得不到不可怕，守不住才是个笑话。 9.你安静的呆在我身旁，恰就是爱情的模样。 10.为什么我脸皮这么厚，还是包不住对你的喜欢呢。 11.我遇见你，恰若春风！你遇见我，风平浪静！我心有海啸！你波澜不惊！ 12.没有完全合适的两个人，只有互相迁就的两颗心。你改一点，我改一点，虽然大家都会失去点自我，却可以成为默契的一对。相爱，从来都不是一个人的事，迟早会有人举着戒指对着你笑，说着余生请多指教。 13.爱是一种需要不断被人证明的虚妄，就像烟花需要被点燃才能看到辉煌一样。 14.虽然终于遇到了对的人，但是却偏偏在错误的时间里，那只能徒留遗憾，不如没有遇见。 15.习惯难受，习惯思念，习惯等你，可是却一直没有习惯看不到你。 16.爱一个人，不是一时的牵手，而是一世的牵心。 17.你脸上有东西，我的目光。 18.你最近是不是又胖了？那为什么在我心里的分量越来越重了。 19.多谢你如此耀眼，做我平淡岁月里的星辰。 20.希望以后有个人 以后艰难险阻都陪着你 为你撑伞 为你添衣 为你赴汤蹈火还乐此不疲。 21.其实最好的日子，无非就是你在闹，他在笑，如此温暖过一生。 22.保持常温的感情是最好的 别人聚散不定 而我们还踏实安稳地走着 真好。 23.幸福，就是当激情退去、容颜衰老，牵你的还是那双不怨悔的手；陪你的还是那颗不回头的心；暖你的还是那份不冷却的情。 24.最难过的，莫过于当你遇上一个特别的人，却明白永远不可能在一起，或迟或早，你不得不放弃。 25.一起老去的日子里，因为朋友的存在而泛着七彩的光。 26.自从你出现后，我才知道原来有人爱是那么的美好。 27.我的世界很简单，只有我在乎的跟不在乎的，以及爱的你。 28.我始终相信这个世界上，仍然有携手到老，至死不渝的爱情。只是没有信心，我能遇到。#f45b725191bd65ad49c5fffc55bc725b.jpg
