让对方看到心碎的伤感句子发朋友圈 痛到撕心裂肺的伤感句子大全#1.你跌跌撞撞，落得一身伤，就当是为了青春落下的残妆。 2.年少无知的时候，是勇气泛滥的年代，因为我们无知，所以我们无畏。 3.你把她逼到了成熟她的爱便再也不像原来。 4.曾经我们以为让我们痛的是青春，最后我们才发现是命运，是人生。 5.总是以爱情的特别之处而将它置于感情之外，多了份不必要的挑剔。 6.我不是什么英雄只是爱他比较奋勇。 7.原来，一切都是我自作多情，你只不过是在配合我演戏而已。 8.藕断丝连是这个世界上最没有骨气的词。 9.我是个和谁都没有未来的女子只饮烈酒不谈往事。 10.时间消磨着情感和记忆，风物换了;眨眼间，人也变了。 11.你有没有一个很爱却再也不曾提及的人。 12.忘掉那些过错和不被原谅的青春。 13.你听说过我，不代表你了解我;你听过一些流言，不代表就是真的。 14.我也想有个人会害怕失去我，哪怕只有一次。 15.你以为放手可以成全我的幸福，可你不知道，我最大的幸福就是能和你手牵手。 16.那些你以为失去的，或许从来未曾拥有过。 17.心事像匕首像暗箭像慢性毒药百转千回偏偏不致命。 18.谁暖过我心窝谁陪我哭过不善言辞的我都记得。 19.失去的东西，其实从来未曾真正地属于你，所以不必惋惜。 20.我知道有些事一生只有一次。可我还是不珍惜。 21.那些刻在桌子上的爱情，会不会像水泥上下的种子，开出没有风的，寂寞的森林。 22.生命中有一些人与我们擦肩了，却来不及遇见。 23.仙人掌明明活的很好，却再没法接受谁的拥抱。 24.原本不可失去的朋友，走著走著就散了。 25.多年后你和她情深似海，会不会想到欠我一个未来。 26.因为有你，我的世界原本很富有;可是现在，我的世界一无所有。 27.总有一天你会发现，时间什么都能改变。 28.社会的现实，让我明白。读书成绩可以不好，但千万别混得不好。 29.总会有那么一首歌，唱出你的希望与绝望，唱到你心疼。 30.我不再爱你的时候，也许不是我不爱你，只是，我已不能再爱你了。 31.那种前一秒，还怀着满心期望，象被推上高高的天空;然后下一秒，满心的失望，象从高空狠狠坠落。 32.倔强地对自己说：我不哭，其实自己已经流了泪。 33.这个世上没有未完的故事，只有未死的心。#2a1bdd75531dc634be33660822e82b4d.jpg
女生失恋分手后发的伤感爱情句子 对方看了想哭的爱情句子大全#1.如何让你遇见我，在我最美丽的时刻。 2.到底没有谁辜负了谁，只有谁忘了谁，谁把谁忽略成了路人甲。 3.思念那种痛，会蛰伏在每一个寂静的夜晚里，会趁人不备跑出来，刺痛你。 4.黄泉路上，忘川河中，三生石旁，奈何桥上，我可曾见过你。 5.人可以放下痛苦，又怎么能放下和抛弃自己曾经拥有过的幸福?尽管那幸福背后，是悬崖峭壁，下面白骨森森。 6.当一个人做出决定，心也就慢慢平静了，只需去做，然后等待结果。 7.爱别离，怨憎会，撒手西归，全无是类。不过是满眼空花，一片虚幻。 8.在你转身错落的那个轮回间，我已万劫不复。 9.世上最可悲的事是当过去深爱你的那个人成为你的一切之时，你却对她不再重要了。 10.一步一微笑，一步一伤心，一步一劫难，尽管记忆再悲伤，我却笑着，不愿遗忘。 11.黑暗中慢慢流淌着悲伤的河流。淹没了所有没有来得及逃走的青春和时间。 12.我一生最大的幸事是，那一年 那一天那一刻我遇见了你。我一生最不幸的事是，我曾经伤害过你。我的不幸和幸运都和你有关，正如我的人生，你愿意原谅我的不幸么? 13.从别后，忆相逢，几回魂梦与君同?今宵剩把银釭照，犹恐相逢是梦中。 14.她才恍然，人生的路上，哭过，痛过，爱过，恨过，笑过，也是一种完整。她现在爱他就是爱他。天涯海角，就这么一个人! 15.有些事情，我们明知道永远没有结果的，也要去坚持，因为不甘心。有些人，我们明知道爱的，也要去放弃了，因为没有结局。 16.很多时候，上天的眷顾要靠自己的坚忍来保护。 17.偏偏是遇上了，不早不晚，就在这个时候，就在他心里。 18.我躺在回忆的风中，用对你的思念取暖。 19.留下的，是注定要留下的。而离开的，若是不想再见，也是注定要分离的。 20.死生契阔，与子成说，执子之手，与子偕老。这句话，虽然好听，却实在是天大的悲剧。尤其，只有一个人，妄想着天长地久。 21.有些事，预见到，是一回事。若是，想要阻止，又是另外一回事。 22.不多不少，刚巧知道;不深不浅，恰是新知。 23.既然今生有缘见，你我相约到百年。谁若九十七岁死，奈何桥上等三年。 24.这世上，能让我甘愿破戒，甘心入地狱的，只有你一人 25.去见你想见的人，去做你想做的事，趁阳光正好，趁微风不躁，趁繁华还未开至荼靡，趁我们都还年轻。 26.被特别在乎的人忽略，会很难过，而更难过的是你还要装作你不在乎。 27.世上最美的，莫过于从泪水中挣脱出来的那个微笑。 28.悲哀是真的，泪是假的，本来没因果，一百年后没有你也没有我。 29.有时我沉默，不是不快乐，只是想把心净空。 30.每个人心中都有一座坟，都埋葬着一个未亡人。 31.懵懂的年纪说不得爱，受伤害的一定是爱做梦的女孩。 32.则为你如花美眷，似水流年。是答儿闲寻遍，在幽闺自怜。 33.其实你要想对我好，就该消失在我的世界里，让我不要再想你。 34.一个人做到只剩了回忆的时候，生涯大概总要算是无聊了吧，但有时竟会连回忆也没有。 35.有一件疯狂的小事，不值得一提的小事叫做爱情。 36.千帆过尽，回首当年，那份纯净的梦想早已渐行渐远，如今岁月留下的，只是满目荒凉。#bd0f32c24243391a6b0635a15d7c84e2.jpg
2018表达心情失落的伤感句子大全 痛到心碎的爱情伤感句子#1.你陪了我多少年，花开花落，一路上起起跌跌。 2.人们总说时间会改变一切，但事实上一切都需要你自己努力去改变。 3.你我暮年，闲坐庭院，云卷云舒听雨声，星密星稀赏月影，你话往时，我画往事。 4.我对人的占有欲，大部分都来源于对自己的不自信，不是不让你和除我以外的人玩儿，而是怕，你遇到更好更喜欢的人之后就和我疏远了。 5.曾在孤独一人的世界里生活过，感受过世界上最可怕的寒冷，所以即使在最炽烈的阳光中，都带着微微的凉意。 6.比孤独更可悲的事情，就是根本不知道自己很孤独，或者分明很孤独，却把自己都骗得相信自己不孤独。 7.有时候人只需要一只温暖的手的触摸,就像是拥有了整个世界。我一直在等，等到绝望。 8.有些路你和某人一起走，就长得离谱，你和另外一些人走，就短得让人舍不得迈开脚步。 9.不要问我为什么会对你一见倾心，因为我是你流浪过的一个地方。 10.专一并不是非要一辈子只爱一个人，而是爱着那个人的时候只对她好。 11.何必向不值得的人证明什么，生活得更好，乃是为你自己。 12.向前走，便走了。这一生，只一次，如何回望? 13.从此各自高飞，过去让它过去，来不及，从头喜欢你。 14.不懂承诺意义的人会轻易许诺，真正重视承诺的人是会害怕誓言的。 15.时光不可倒流，所以最动人的誓言不是“我爱你”，而是“在一起”。 16.有时候理智叫我们做一些清醒正确的事，可感情偏偏逆道而行。 17.最辛苦的不是两地相隔，而是明明相爱，却不敢想未来。 18.我的青春乏善可陈，自始至终，只你一人。 19.你是世界上最美丽的琉璃，镶嵌在我的眸子里，我从不曾落泪，以为你能在我的眸中永远璀璨。 20.青春本就像一场盛大豪华的梦，尽管曲折漫长，但梦便是梦，终有结束醒来的一天。 21.只怪我，在和你朝夕相处的岁月里，忘记了对你说出那些爱意缠绵的话语。 22.若是能做到不在意，何苦又要去惦记它，有时忘得一干二净不是遗憾，而是一种幸福。 23.昙花一现，浮游一生，芳华只在一霎那间绽放，握住了便是一生一世，它只为一人而开。 24.无数的曾经转眼化作过眼云烟，无数的誓言最终一炬成灰。 25.一个人只能给一个人幸福，其他的则是不幸。 26.想从这一刻重新来过。为什么。因为我后悔了。 27.我们以为的永远不是现在不是未来，不是以后，是拥有的回忆。 28.原来我们总说要永远在一起，其实永远不是以前或者未来，我们在一起的时间，就是我们的永远。 29.我想从这里开始重新来过，和之前不一样的重新来过。 30.那时候，我们以为喜欢就是永远。后来才发现，我们只有曾经，没有永远。#116863defda94179104dbeaedd6e9ea1.jpg
早安2018的正能量阳光早安心语句子 很励志又有哲理的励志句子大全#1.上天不给我的，无论我十指怎样紧扣，仍然走漏;给我的，无论过去我怎么失手，都会拥有。 2.要想成为强者，就不要回避心里的恐惧，恐惧并不是弱点。强者，是要让你的敌人比你更恐惧。 3.人生不过是一个如鱼饮水冷暖自知的过程，对每一个自己来说，任何人都是“局外人”。 4.黑夜给了我黑色的眼睛，我却用它寻找光明。 5.我们一步步走下去，踏踏实实的去走，永不抗拒生命给我们的重负，才是一个勇者。 6.对生命而言，接纳才是最好的温柔，不论是接纳一个人的出现，还是，接纳一个人的从此不见。 7.当爱情缺席的时候，学著过自己的生活。过自己的生活，就是跟自己谈恋爱，把自己当成自己的情人那样，好好宠自己。 8.这个世界上肯定有另一个我，做着我不敢做的事，过着我想过的生活。 9.当所有人都拿我当回事的时候，我不能太拿自己当回事。当所有人都不拿我当回事的时候，我一定得瞧得上自己。这就是淡定，这就是从容。 10.拥有和舍弃都很痛苦，既然无论怎样都会痛苦的话，我宁可选择守护它而痛苦。 11.无论今天发生多么糟糕的事，都不应该感到悲伤，因为今天是你往后日子里最年轻的一天了。 12.说出来会被嘲笑的梦想，才有实践的价值。即使跌倒了，姿势也会非常豪迈。 13.没有一个人真正知道自己对生命的狂爱的极限，极限不是由我们决定的，都是由生活的经验中不断的试探中提取得来的认识。 14.在时间的大钟上，只有两个字「现在」。 15.尽管也曾有消沉的时候，我还是过得佷好。 16.所有的女孩都是荔枝，新鲜不了多少天，别用有限的青春去等一个男人不可预知的前程，等不起的，吃亏的到头来是自己。 17.人，只有在放弃战斗的时候才算输，只要坚持战斗，就还没输。 18.一辈子是场修行。短的是旅途，长的是人生。旅行，能让你遇到那个更好的自己。 19.其实地上本没有路，走的人多了，也便成了路。 20.一个人怎么看待自己，决定了此人的命运，指向了他的归宿。我们的展望也这样，当更好的思想注入其中，它便光明起来。不管你的生命多么卑微，你要勇敢地面对生活，不用逃避，更不要用恶语诅咒它。 21.两个人同时犯了错，站出来承担的那一方叫宽容，另一方欠下的债，早晚都要还。 22.你的负担将变成礼物，你受的苦将照亮你的路。 23.其实我们每个人的生活都是一个世界，即使最平凡的人也要为他生活的那个世界而奋斗。 24.优于别人，并不高贵，真正的高贵应该是优于过去的自己。 25.很多人闯进你的生活，只是为了给你上一课，然后转身离开。 26.爱情是灯，友情是影子，当灯灭了，你会发现你的周围都是影子。朋友，是在黑暗时候给你力量的人。 27.很多事情不能自己掌控，即使再孤单再寂寞，仍要继续走下去，不许停、也不能回头。 28.雨水落下来是因为天空无法承受它的重量，眼泪掉下来是因为心再也无法承受那样的伤痛。 29.我从没被谁知道，所以也没被谁忘记。在别人的回忆中生活，并不是我的目的。 30.爱情，不仅讲究门当户对，也讲究棋逢对手。#f099c7a607b6c86145d14b360924e635.jpg
写给对象超甜的句子比初恋还甜 周杰伦的晴天都不如你和我聊天#1.有五分喜欢的人，恨不得把他挂在嘴上招摇过市。有七分喜欢的人，就只能跟至亲密友分享。有十分喜欢的人，就谁也舍不得说了。憋着，每天憋着一点小高兴。像只松鼠攒着满腮帮子的果仁儿。 3.人生只要两次幸运便好，一次遇到你，一次走到底，一直忘了告诉你，我有多幸运，遇见的是你。 4.也许现在的我缺席了无数个日子，让你寂寞了很长一段时间，不过，我发誓，今后余生，我一定会好好守护你! 5.最近我牙齿痛，因为常常晚上想你，那感觉太甜蜜了，会蛀牙。 6.你在我左胸第四根肋骨一寸往里的地方，听他们说那里是心脏。 7.我发现你是个照骗，因为本人比照片好看多了。 8.我从来不会对任何一个女人许下诺言，也从不曾对任何一个女人做我曾为你所做的事，你在我心目中是多么的不同! 9.你会喜欢我吗不会就赶紧学。 10.只要你一直在我身边，其他东西不再重要。 11.你有男朋友我只有一个情敌，你没男朋友全世界都是我情敌。 12.青梅枯萎，竹马老去，从此我爱上的人都像你。 13.可能我有时会无理取闹，喜欢捉弄你，固执己见，自私任性，让你觉得心累，所以我并不要求你也一样爱我，但任由沧海桑田，世事变迁，对于我来说，最重要的依然是你，你是我唯一的太阳，而且直至世界毁灭也不会改变。 14.愿意陪你吃饭的人，酸甜苦辣都爱吃，想见你的人，小时都有时间，聊得来的人永远不会嫌你话多，宠你的人你吃的在多我不会笑话你，疼爱你的人会想尽一切办法逗你开心，想送你回家的人，东南西北都顺路，只要他喜欢你，你怎么样都行。 15.一辈子那么长，一天没走到终点，你就一天不知道哪一个才是陪你走到最后的人。有时你遇到了一个人，以为就是她了，后来回头看，其实她也不过是这一段路给了你想要的东西。 16.隔着人山人海，能看到你，走近你，真的很幸运。喜欢上一个人是一件小概率的的事，所以遇到了就别放手。 17.只要你愿意，当你失落失意的时候，最需要一个肩膊的时候，告诉我，我会立即出现。 ​18.最好的爱情大概就是，我崇拜你像个英雄，你疼爱我像个孩子。 19.我对你的爱，永远比昨天多一点，比明天少一点。每天爱你多一些!无论风筝放飞得有多远，线始终扯在风筝人的掌中，无论我在哪里，我的心始终陪伴着你。 20.你知道我最大的缺点是什么吗?缺你。 21.我与世界只差一个你，因为是你，晚一点没关系。 22.你是年少的欢喜，我想把这句话反过来告诉你。 23.比起隔着屏幕互道晚安，我更想为你盖好被子。 24.三里清风三里路步步风里步步你。 25.如果没有时差就好了，我喜欢你的时候你也恰巧喜欢我。如果没有告别就好了，我想念你的时候你恰巧就在我身旁。你的眼睛像最深的黑夜，却藏着万家的灯火。你的眼里有世界的风景，却住不下一个我。#70831023cd6719c28c262816a3169b38.jpg
2018姐姐结婚祝福语特别的 祝福姐姐新婚句子感动发朋友圈#1.姐姐，真心的恭喜你找到了人生伴侣，我相信你做出了最正确的决定，愿你和姐夫今后的每一天都像今天一样幸福甜蜜。 2.玫瑰代表着甜蜜，牡丹但别着富贵，百合代表着百年好合，今日，我将玫瑰牡丹和百合统统献给你，愿你的婚姻生活也甜蜜幸福，祝福你们! 3.亲爱的姐姐，今天是你和你心爱之人结婚的日子，弟衷心的为你感到开心，当你穿上婚纱的那一刻，你就是我眼中最美丽动人的新娘，祝福你们永结同心，永远幸福。 4.这一天，我为你欢呼，为你祝福，我的心情同你一样激动，作为你的妹妹真心为你感到开心，姐，祝你百年好合，白头偕老。 5.今天，阳光温暖的照耀着大地，鸟儿愉快的哼着歌曲，一对才子佳人携手迎接幸福的到来，祝福你们爱河永浴，幸福美满。 6.今天是姐姐一生中最美好，最幸福的日子，给姐姐送上新婚祝福，希望姐姐万事如意，心想事成，婚姻幸福。 7.愿你们两彼此相爱相顾，互相体谅理解，共同努力向前，建造幸福的家庭，拥有一个可爱的小宝贝。 8.甜甜的喜糖比不上你们心中的甜蜜，浓浓的玫瑰香比不上新娘的芬芳，喜庆的日子笑声一片，祝你们白头偕老，幸福永远。 9.姐姐，你亲爱的弟弟，祝愿幸福快乐，平安永远相伴随你身边，祝福姐夫和你，早生贵子，百年好合。 10.清风送去我的祝福，流云托去我的情谊，看着姐姐身穿洁白的婚纱，手拿着美丽的捧花，缓缓走向心爱制热，我的心情也无比的激动，姐姐，新婚快乐。 11.姐姐，没想到这么快就迎来了你的大喜日子，小时候的点点滴滴防毒还在昨日，我最亲爱的姐姐，你一定要永远幸福。 12.今天是姐姐与姐夫喜结良缘的日子，做弟弟的祝福姐姐与姐夫白头偕老，永远幸福。 13.美丽的姐姐，在你如此重要的日子里怎么能少了我的祝福，祝你与姐夫执子之手，与子偕老，姐姐，一定要幸福到永久哦。 14.姐姐与姐夫于茫茫人海中相遇，分明是冥冥之中早已注定，看到姐姐幸福我感到非常开心，祝永结同心，相伴永远。 15.愿你们的爱情之火永远燃烧，就如同初升的太阳，越来越旺，姐姐，新婚愉快。 16.恭喜姐姐你要结婚了，祝你幸福美满，永浴爱河，新婚快乐。 ​17.姐姐终于要告别单身了，也表示找到了真爱，身为你弟弟，我感动无比的开心，祝福婚姻甜蜜美满，一辈子不离不弃。 18.结婚是一辈子的幸福，从相知相识，到步入婚姻的殿堂。今天姐姐终于结婚了，祝你们新婚快乐，爱情甜蜜。 19.在这阳光明艳的日子里，愿你们俩永结同心，正所谓天生一对，地生一双。祝愿你俩恩恩爱爱，白头偕老，姐姐新婚幸福。 20.为你祝福，为你欢笑，因为在今天，我的内心也跟你一样的快乐。祝姐姐百年好合，白头到老。 21.今天百花为你们芬芳，小鸟为你们歌唱，幸福展开甜蜜的翅膀，快乐在阳光中放声歌唱，相爱的恋人走进结婚的殿堂，愿你们携手奔快乐，幸福万年长。 22.正所谓天生一对，地设一双，今日你们共结连理，愿你们今后互相照顾，彼此理解，祝福你们新婚快乐! 23.十年修得同船渡，百年修得共枕眠，在茫茫人海中与他相遇分明是上天的牵引，在这大喜的日子里，祝我最亲爱的姐姐新婚愉快，与姐夫永远幸福美满。#b5c9a49a0f8d73616620d2495e140e92.jpg
岁月静好人世安稳的唯美句子大全 文艺小清新喜欢的文字控唯美句子#1.想你时望天空也多应景，低下头身边却无你同行。 2.理想不过多年后酒桌上的感慨，学会喜怒无泪世故里不再失态，可为何，醉后还会觉得悲哀。 3.默默付出了所有那么多年，最后不过换回一双哭红的眼。 4.年少时不知世事总爱强说愁，也学古人用七律来题诗一首，而今月色朦胧时酌一壶酒，月光下的词稿已堆了几尺厚。 5.京城往北再十里的客栈，荒烟马蹄怎么够我御寒，店家陈年的女儿红来一碗，故乡的炊烟在酒中弥漫。 6.总有些爱是当时未能发觉，总有些事是错过以后才慢慢了解。 7.倚窗聆雨忆江南，何时再与你把盏言欢，填词一曲菩萨蛮，琴瑟悠悠长相伴。 8.当我终于写完这个剧本，我还是没有忍住痛哭失声，故事里的情节并没有发生，虚拟的结局让我字字饮恨。 9.西子湖畔你撑着油纸伞，扬眉一笑得很嫣然，风轻轻吹过你发端，身旁的风景突然就黯淡。 10.轻巧的来了，走的时候，却显得格外沉重。我将永远也无法忘记那阵甜风，是它，入了我的梦。 11.当我决定原谅你并再次爱你，就仿佛一个溺水的人任性放弃自己，往深处的泥潭里肆意沉去。 12.我通过做很多无意义的事，来形成意义;我通过靠近这宏大的世界，来抛弃世界;我通过爱你，来不爱你;我通过接近你，来远离你。 13.待你我都到暮年，便隐居山林，日出登山采薇，日落读诗煮茗，想想时光走的云淡风轻，还有过往的红尘风景。 14.故事讲完，说书人折扇辑首，赢得满座喝彩掌声不休，说书人却悄悄拭着衣袖。 15.从天长地久到情寿不深，要泪湿多少次眼眸，从年少温柔到须发白首，要耗尽多少个年华等候。 16.故事里的男女都执手成说，故事外的我们却各自蹉跎，你给我的深刻，在我的笔下美好很多。 17.倚窗聆雨忆江南，何时再与你把盏言欢，记忆还刻在青石板，情缘已如炊烟散。 18.青葱年月里谁不曾疯狂过，年少日记里，泛黄的是执着。 19.就让时光这样过去吧，就让爱情轻易地来，也轻易地走。就让所有的情绪都将将停留在欲哭之前。 20.陪我共饮的是影子，杯中浮现的，却是你的样子。 21.如若城市里有醉人的情愫穿过，请告诉我一声，我去找来，绕在手指尖上。 22.我去和你道别吧，就仿佛从没听见你说的那句再也别见。 23.如果注定这首诗只能写到三行，我该用怎样的措辞，才能让你难忘。 24.没有你，写诗的夜晚，想念，是我余生的灵感。 25.人类最大的可悲之处是，创造了语言，却仍旧无法表达心中所想。我们是有声音的哑巴。 26.我们都擅长不动声色，如我们也擅长爱而不得。 27.带我到荒芜里，或者跟我走，去体验鲜活。 28.成长是那部让你哭的电影，从看到鼻酸到平淡。 29.我对你感到抱歉，不是因为我不爱你。而是因为，我深知爱一个人的苦痛，却偏要你也陪我去受。 30.不是所有的铭心刻骨，都能够换来两个人的同途。 31.是我的心太伶仃，才能铭记，你十年的容音。 32.要走就赶早吧，先生，晨露才散，日头未起，正适合赶路。你去你的山高水长，江湖庙堂。我在这里等夜来了，煮一壶酒，代茶。#c2bb8e57cd8b70d890858e1c9d9f9b79.jpg
